comment,rating_star
performance as expect super fast ship received via self collect less twentyhrs thanks seller ! outer box inner box item wrap bubbles just nice size carry storage color too malaysia plug not_a problem,2
performance okay safety okay sorry review onest nak nak mmg mmg sgt satisfied beautiful sizing okay x -big x too small buying blend food six sixbulan easy fast x many item easy wash kaler nude not spatula happy nk kaut mananan packaging mmg tiptop blh praise very much blender blender n't throw away seller tread price price blender price very cheap buy wedding gift kwn² family overalls,2
dah try function elok cheap prices item wrap very carefully box lepastu box bubble wraphti color also beautiful tq seller,2
"safety excellent performance good okay in order cook use family prices pleasure working choping not_bamatwo very pressing bahantwo hot little engine pandaitwo sentence particle chopper , form chopper also friendly user recommend",2
safety safe performance da try blend water mmg sanduuuu man make abc da kt house of house ye strong ye bikah he hope durable here buy skali voucher,2
safety far good performance good received item good condition well secured package value money purchase easy use product delivery also super fast thank seller delivery service,2
safety bubble wrap thick performance good sharp knife i buy blend food food size pn nicely remember very little apparently apparently simple size likes soft pinktwo color,2
performance good safety surely yes delivery sgt appropriate item accepted good condition far good important facilitates work cook tq seller,2
satisfied share najuu n sajuu price very cheap price ! beautiful design easy bring easy go plug three pin spatula sharp knife recommend one looking cheap chopper,2
performance excellent safety safe use size nice powerful price very affordable too get sale even cheap packaging excellent seller,2
safety good performance good very good product quality very easy use very affordable user very fast delivery service very save money,2
beautiful color size just nice tak_besar n tak_kecik low prices skali black plastic spatula accept good condition takde thanks thank,2
performance good function well safety safe received item good condition fast delivery comes box outside love colour not_white beige aesthethic colour works very well very function worth buying cheap buy live sale,2
safety perfect performance amazing item received good condition well packaging fast shipping seller very satisfied quality product make life easy,2
performance far ok safety good accept item safely appropriate test empty ok not test ingredients appear quality cheap prices worthy five recommend,2
performance very good safety safety brg arrived ok perfect according price beautiful cheap colors best mmg senap,2
performance good² safety safe item accepted good condition decent delivery saiz rather large smaller saiz i like also tq seller shopee price not mind very cheap,2
safety ok performance ok item survived good condition packaging good congratulation not try hrptwo ok trme ksih seller,2
"safety thank god alhamdulillah ordered item arrived safely wrap beautiful neatly function well , thank , thank .",2
performance good safety yes item receive good conditions definitely repeat order ! btw thank seller nice packaging need careful blade blade very sharp,2
parcel safe good state worth quickly righteous package package ok enough accessories beautiful black look luxurious giteww parcel continues open cuba chooper works good perfect situation happy ok assessment tired thinking long verse apapon all ok thank seller,2
"safety very happy happy install handle performance not tried feels like n't press long time nnt motorbike heat according sentence particle price fast maybe i selangor fast . tq seller isha kitchenia , performance performance not_cuba anymore careful , n't heat , price price not heavy duty .",2
performance safety three pin plug safety sbb fius earth wire packed box bubble wrap delivary pantas rupa cantik warna estetik,2
performance good safety safe thanks seller quick response super fast shipping works well makes easy prepare chicken marinade breaking fast tonight,2
performance good receive good condition sound xde la strong very try buy blend sambal expensive containers glass plastic price price beautiful color blender,2
quick delivery pon pon goods walaupon cheap prices serious mmang mmang berbaloi buy ye all function well pound goods beautiful,2
safety good performance good fast delivery well received good packaging item good condition good quality great service seller courier service highly recommend thank,2
performance ten ten safety good comey dooh laa color chopper ni lovee sgt sgt jgk too weh want kecik comey ja baloi price function well bg even marriage gifts also cheap nmpk mahai,2
"alhamdulillah , blender accepted beautiful condition not broken troubles seller very good , superb packaging small , remember big , apparently tip top blender skjp broken , even though cheap expensive brand expensive brand",2
"good safety good performance item received good condition check sbrg kerosakkn function well buy time live cheap , like like small big x",2
safety safety good three pins plug performance excellent product receive good condition tried very well performed hopefully last long worth buy recommend,2
safety good performance good alhmdulilah finally also old grab save kt troli satisfy ht very item sampi xde rosak xde broken ni bukn white mcm color beigetwo also ingt white xpla jnji sentence particle for thank seller pghntrans pghntrans pghntrans pghntrans pghntrans pghntrans pghntrans pghntrans pghntrans pghntrans pghntrans pghntrans pghntrans pghntrans pghntran,2
performance good safety good good wight with worth items accepted heason heart with qualities are construction make a ringantwo sahaja sah,2
safety good performance good received good condition function well head part quite heavy make device solid surely very useful cook nice color,2
"multifuntion food processor arrived safely wrap box good condition food processor looks very quality simple saiz i like use daily use cook happy wash , i hope product good lighten work",2
performance very function good best safety goods quickly wrapping safe goods good perfect very recommend seller tqvm seller,2
performance very good diterima besar igt je berbaloi beli mmg sgt ok brand swiss thomas plug three pin harga berpatutan bubble wrapping service bagus thank seller,2
performance berfungsi dgn received parcel good condition packaging very good quality tak_sure tahan lama beli time sale live murah sbb voucher thanks seller i recommend buy,2
received good condition order loveeee color so far function well blend chili blender save space keep thank seller courier service,2
beautiful performance safety pink color harapantwo may durable i like color beautiful attractive get independent voucher thank seller abg kurier fast delivery congratulation destination,2
safety good performance good packaging good another box delivery man carefully placed front door even though i not_around i think small big enough process food very convenient eleven year old daughter handle,2
performance good safety ok my best purchase ever cheap price come spatula mixer multipurpose use daily cook baby food thankssss,2
"alhamdulillah , goods arrived safely , delivery , hawking item fast , good good condition price beautiful pound qualiti looked expensive , i very satisfied item receive , thank , yeah",2
"swiss swiss good safety performance thomas multifunction food processor dah delivery good packaging prices very good price good qualiti not try blend ice , hope function well durable tq seller n courier",2
didn expect receive early all item good condition excellent packaging good quality well very happy satisfied highly recommend thank seller,2
good safety good performance good delivery goods perfectly wrap good price good quality i buy item price . thank,2
performance v gd n strong safety v gd too received item arrived safely never_expected big think small one like n v affordable gd packing too thank seller highly recommend,2
packaging really good delivery fast quality goods also quite good i like much thank !,2
safety excellent performance very good semalam order ni dah sampai good job seller thank sooo much ! packaging pun sangat secure barang much cheap shop kalau nak ten stars,2
"safety good performance good item functions well quickly happy used happy save cheap seller recommend sgt² facilitating cake cooking delivery , worthy",2
performance functions perfectly safety intimate user time time i go two i repeat one mum mum love bend i buy mum mums important thing,2
"performance good safety good good delivery brg good condition neat packaging packing sharp blades thick plastic pushes even make sauce apatwo , 's happy destroyed prices still satisfied .",2
"everything ok xdk msalh dioder color also beautiful , white bukn correct , pace packging ok , bubble wrap .",2
safety good performance good goods worthy,2
safety good minimum vibration performance blend well fast delivery good packaging blend well refer video photo cut food smaller pieces blending good product quality convenient use tq seller shopee shopee express,2
safety ok performance ok cpt nye sampai two hr je tq seller beli twelve twelve dpt voucher hrg murah berfungsi dgn color pn cntik nnt try blend lada dgn bwg ye,2
performance excellence safety good cepat yer delivery dia sangattwo suka chopper mcm ni simple n xde la mkn space byk nak simpan blades tajam giler hati² unboxing triple box n cukup dgn bubble wrap drg ni bungkus chopper sampai dgn selamat n sangat puas hati highly recommend rating ten ten,2
safety very safety performance not_sure but i think very nice chopper dah buy mak happy nk for sambal chopper comel sumps facilitate work load ni delivery also very pace package wrap well thank seller,2
"safety very , safety performance very good , love teroks new gadget also white esthetic white not_pure white white mcm kalertwo cream nude like",2
safety think good performance block try beautiful not copper far goods good condition color cm picture satisfied tq,2
safety ok good performance appropriate delivery item accepted good condition tq seller ever used water fyer jenama ni indeed best red order white xpe blh cheap shop serving,2
safety okay performance okay top part bottom part doesn click anything put use but like though quite big i expect two person okay,2
delivery three three choper ni beautiful color also looks luxurious saiz not really not very big packaging even packed x kemek also hope durable tq seller ok ok blh repeat buy,2
performance very good safety safe enough use twond purchase brand really good cooking speed time chili onion mix very well thank seller good product,2
performance good performance beauty shape safety very safety use faster delivery very good product nice use price reasonable take one day deliver product buy gift friends,2
safety love chopper performance very sharp twond time buying chopper i love colour very good n nice will buy gift time delivery very fast,2
performance ok safety ok goods received good condition also fast delivery also packaging receiving impression trouble thank ok like picture thank,2
safety heart sagat knife sharp performance functionally alhamdulillah item congratulation until tq likes sagat x ade anyway nnti nnti buying kat saller nie best price .,2
"performance very good function safety good function well , not test blend .",2
safety ok performance ok received item good condition well packaging fast delivery too seller courier shopee xpress best overall good value money,2
performance good safety good goods well receive like picture video fast delivery seller packaging takde box box easy use indeed buy happy son cook,2
performance ok safety ok buy two sets one wet n one dry peanut seem good not_try making sambal paste yet seems ok thank,2
performance yet discover safety shoud okay goods received good condition well wrap nice pink color but manual chinese realised english version also available,2
"best performance safety baguihh ok , ok , i use , dye tk lumpy fine dye dye dye castry but buy buyt igt kcik je skli to the bigrrrrrrrrrrry eyes alstall",2
performance not efficient big weh very seller pon post spx pace spx pon hnttr pace good try blend empty functions nt blend mknan plaque,2
safety performance not tried item received safely order four days very fast according cook fast month later tq seller,2
performance okay safety okay i not_using yet love color match aesthetic concept delivery super duper fast ! thank seller i ordered last night received today !,2
safety ok performance ok saiz nice not too big daily use very suitable large not inadequate people cook little family kecik,2
best performance safety congratulations ade salam so congratulation use use sgt sharp guys guys even beautiful xde tiptop service bole buy jenama ni beautiful jenama dessana tu hahaa fhmtwo jel,2
nice colour delivery sehari dh sampai trusted seller byk dh brg swiss thomas i beli so far quality dia tip top tq seller shopee voucher,2
"performance very good safety very safe because strong sap installing , i buy , i think motorbike heavy very strong blade power highly recommend house animation",2
functional performance very functional ! buy time live cheap free post function well thank seller very appropriate ! onest buy defect plag almost pulled force return refund order fifteenhb yesterday harini appropriate courier !,2
safety good press start release stop performance far good came complete set whisk scraper worth price paid,2
"performance good safety not_sure thank sellers last night 's order today deserves seller kj price price price , please last long time tq seller abg courier",2
best la shopee choice local packaging stilla tiptop ready elbacked elk delivery blender very cheap price buy kt kualiti jenama swiss thomas sgt satisfied tq,2
baru try sgttwo digunakan color pun cantik blh blend halussss utk buat bubur bayi service barang super sgttwo recommend utk membeli order ship twenty five nine twenty four received twenty six nine twenty four,2
performance very good safety very safe buy second time make prize item very very useful facilitate matter cook delivery very fast speed je recommend,2
"safety performance goods very fast packaging very good three box seller bgi item , test not four day , tq seller",2
"safety okey performance , alhamdulillah , goods safe everything good condition , surprised look big thing , small remind small thing price able belong packaging packaging best seller seller",2
okay safety performance okay best packaging in box confirm box item tak_pecah item complete color actually not_white beige nude runs away theme still lawa la la,2
safety very good condition performance very function pghntaran yg cepat chopper yg sngt cantik n like very much blum cuba lg hope evrythe ok n blend smua jnis mcm yg disiarkn dlm video,2
"good performance may range smooth safety knife -resistant knife use good blender nie ingt right , best also best fine blend , buy two units close ank also good package also ready bubble wrap tq seller",2
safety yes performance quickly destroyed item survivors delivery very pace xkcil xkcil xkcil xkcil tuna tunci jerk jerkan jerkan sentence particle supermom mcm nie kat kitchen nak blend objects kitchen buy sentence particle guys,2
"safety good performance good , i buy two sets kahwin kawen prizes , i test function very well later , i buy , beautiful red",2
safety good performance good thank seller item paduu function heyday delivery really deserves smlm oder today pace sellerr reja torrrbbbbiikkkhhhhhhhhhhhhhhhhhhh,2
fast delivery very beautiful colors item works very well i enter fiveulas garlic result careful controlling blade very sharp knife saiz xbesar very not very small really not two_hundredgram meat thank seller,2
performance good safety good item receive good condition ordered one one two_thousand_and_twenty five delivered two one two_thousand_and_twenty five will update review tried item thank seller runner keep good work,2
blender arrived beautiful situation packing best i star delivery very pace sell tk cuba use,2
"good safety performance very helpful happy discovery buy price rmtwenty three include postage , choose caler white cream seller wrap best way three layer boxes ready plastic bubble later , son buy lg tq seller",2
good safety good performance good packing bubble wrap n double sound box not really blender beautiful maron color spatula,2
performance well functional safety good received good condition item comes double box very fast delivery recommend item seller worth buy thank seller,2
performance good safety yes satisfy result make sambal looks good price affordable too u coins claim cheap price easy handle insyallah safe u handle care postage fast tqvm seller,2
"safety safe performance function well comel pinky ! buy blend porridge baby rice baby also blender nie prices even cheap affordable je functions very son bring travel , ok nie fast delivery ! best tq seller",2
safety no_key lock performance good fast delivery good packaging nice pink colour looks stylish easy clean just nice day day use second purchase,2
performance nmpak mcm ok safety best item safely order twenty fourhb twenty sixhb dh get dh test machine function very well packaging satisfied layer layer delivery box pn .,2
safety ten ten perfunction function good buy live time murmurr prices best chopper not_at pon sgt useful rough blend chili bwg seller wrap thickness tiptop chopper delivery functions well very recommend very recommend,2
good performance good safety seal hrga belastwo period live sgt buy siblings wear beautiful color rental pound,2
performance work well ! safety pretty safe chopper pretty durable easy assemble noise isn too loud personally i think very much worth price ten ten,2
"safety good performance great goods pace even though i close sabah i ordered day arrived moment sentence particle later original review , yes",2
"safety congratulation use recommend goods post best best good condition functions properly , thank , seller price very stabbed",2
safety good performance advertised product wrap bubble wrap delivered safely time comes exchangeable accessories cut mix even small spatula scrap wet mixtures sides container grinding done all product good kitchen want prepared small batch ingredients,2
"performance test later safety careful ur finger mandatory look video buy promo less thirtyrgt i ordered harini tomorrow gilosss jrg shoppe efficient camni packaging three layers boxes bubble wrap tue n't test yet i n't cook later xbagus i surely update back i xupdate tue , consider satisfied i satisfied",2
very easy buyers select item displayed advert courier service deliver item very fast every process updated application item received perfect condition perfect packaging methodology good item good service seller recommend thank,2
good safety good performance tq seller accepted good condition packing double box cuba ok sharp blades .,2
"safely arrived parcel all item little heavy , i look pink calers brands finish anyway very nice , price cheap , price cheap",2
safety looks good quite safe use performance good hard ice smash hope lasts fast delivery tq delivery service ! good product described seller friendly responsive will definitely buy future item parcel very well packed !,2
cheapest good safety good safety performance i meet meet happy use ni ni destroy all haha haha knifs already service before buying ni calard aesthetic gitewww pos out fast good job seller,2
"safety half half performance one_hundred nice not sent , item gentle reminder read not_nak rosak item suitable bachelor not_peru buying big blendar bona ! ! ! love color even though design looks la color beautiful beige , thank safety packaging",2
safety good performance good goods survived last night twenty seven eight morning morning chance review order twenty five eight quickly le eight tkde item sting bubble rap put n dubble box tq seller,2
safety very safety convenience performance very sharp smooth thank much seller fast delivery product good quality hopefully u long time,2
safety knife really sharp functions well performance really good i buy one early time i buy two one gift really practical electrical chopper space saving too also good three pin plug,2
"performance function safety yes sory slow review nak test good goods facilitating work kitchen size happy happy wash chicken , ok nice nice tq seller",2
performance good function well very sharp blade safety safety yess hit handle blade blade very sharp delivery deserves x -worth delivery worthy way sabah sabah thank seller courier,2
performance ok safety ok beautiful caler nude bkn white not cuba hrp ok ok tgk review rmpi ok hrp facilitate requirement kitchen tkada reason lazy reason yer sentence particle ler rmai ² buy kt saller nie satisfied,2
"safety good performance facilitate mak 's work kitchen fast easy not_lelu nk mashing stones sgt , ok , everyday use seller seller .",2
safety yes hope performance far good grinder cutter well received tried works very satisfied shape beautiful i hope used long time thank seller,2
performance safety goods quickly appropriately goods wrap well neatly sorry video xde knows function well function lacks noise buying live times cheap tq seller,2
performance not cuba new safety blum goods state ok not break rosak package p pack crowded review ok said shopee live cheap prices,2
performance functions well safety ok blender looks like ok test functions well beautiful cute not suitable blend hard objects like ais tq seller i buy price paid,2
safety easy use just received not_use yet chopper beautiful big ! i think small very satisfied product want give one mom birthday present tq seller great product reasonable price,2
best function well today oder tomorrow fast seller work buy cheap live period .,2
performance good safety looks solid ok received product good condition solid looks cute i still haven used i hope fine i like thank seller,2
good performance safety good alhamdulillah buy middle sealer period live price talisman very package .,2
packing ok quick delivery receive item ok little calar ok jer cuba functions well try ice blended ok very dried wet ok recommend,2
performance good safety safe sooo cute cant believe price appearance performance amazing color looks expensive i love much thought small quite big only thing i try reach seller ask put white rubber hope getting answer thank,2
performance good safety very good dah buy one lg lg happy sgt all ok ship out quickly wrap ok thank saller shoppe,2
safety ok ok performance mini chopper blender long time opportunity nk review indeed best many help kitchen cover tight nk fine blend chili fill little wrap water .,2
"good safety performance item accepted good condition balang not thick , please use longer according price remind small seller also amount",2
safety good performance good goods until safely blending function term easy use nak blend onion or chile nak nak water ok mix water ok ok plug three pin makes easy,2
performance test empty machine function well safety blender jar hopefully tough not_crack blend nice design motor function well hopefully good safety operation,2
"safety bagus really buy cheap price buy new home , thank get lawa item function well",2
safety okay performance good kaler lawa cheap price else ask ! hope tahan lama sentence particle dah six blender macamtwo brand dah guna sume jahanam tq seller,2
"performance ok , thank item dh fast shipping x try blend cuba cuba install plug blade smoothly gmbr last tu mcm hope impression little x feels very calar tu think overalls ny ok tq tq tq shopee",2
good safety good performance three pin plug happy function beautiful hit little bit little not_sentence particle son blend contents,2
safety good safety performance function well double box bubble wrap inside sound not_too loud overall i satisfied not_too big not_too small colour soft pink nice,2
safety ok performance ok buying black one time time buying pink pink n't cuba black one ok like working kitchen buy one blend fruittwo,2
good performance safety good very useful gajet sharp kitchen blade instant jend kaler not_so white tu nude beautiful cover closing best machine delivery,2
"safety yes performance good alhamdulillah item good state fast all brg enough bubble wrapping sgt thick god willing , repeat buy tq shopee anqwam",2
"good performance safety congratulation use goods day , pace right twenty six ten pay twenty seven ten , use , color beautiful .",2
safety sgt congratulation useful best performance n blh come smooth item safe best packaging wrap box outer box best,2
item worked perfectly heavy quality good love colour looks expensive doesn look like cheap item well wrap double boxes bubble wrapper,2
"safety congratulation plug three pin happy licking performance advertised delivery deserves pack spi three box try good , not melt .",2
safety seems safe performance powerful yet try chopper seems sturdy able cut large chunks vegetables fruits small pieces definitely would recommend buying need affordable priced chopper,2
"safety good performance good blander function well many times satisfied , i chance date , satisfied using new rate , hehehe , i satisfied",2
item reach good condition delivery wrapping very neat kisar ais x recommend knife blunt,2
"safety good performance good alhamdulillah , i n't think last night 's order today liked design color beige , not , yehe , important thing",2
service pantas pakaging sampai three lapis kotak thank seller excellent service happy purchase good value money,2
"safety happy n safety performance good blender good , son , rough , n't add fine water , add water , right",2
