comment,rating_star
received good condition very fast delivery estimated time good quality product well cook function worth buy shopee app sales,2
delivery somewhat appropriate receive goods good condition apatwo faulty dent pon wrapping ok far use water fryer ni happy diar pon ok ok may appear build quality mmg best pon design beautiful pon happy story very public heart really recommend,2
tqvm seller tq poslaju pos overnight dr. kl dah until today kat tengganu package pack thick korang takyah mmg congratulation ready sticker fragile prices standing berkaloiii very beautiful air fryer productskkk likes sgt color die four twoliter ok very trusted seller,2
beautiful korang air fryer nii i buy happy use too many times indeed function well recommend guys especially make prize delivery shop days may seller checks item post thank seller,2
"received good condition ! function elok my brother cappened sound likes airplane not_that loud hard basketball , i take okay je",2
work well ! i use five times works wonderfully colour nice too packaging top quality styrofoam keeps everything flawless scratch free basket twentyxtwentycm big enough single student like love ! ! ! ! ! ! ! ! ! ! ! ! ! ! ! ! ! ! ! k,2
best performance best safety onest time buy air fryer dah try cook chicken ok all tray nak sak enter x smooth tray in tu hard be hard press bottom ok important senim two -year -old waranti survive five year ok ok x hit point haha ​​haha,2
performance fryer function well safety far okey dh try masak donut ngn kentang goreng everything going well smua function colour nice besar pon puas hati beli,2
order six six dpt fourteen six overall okey af function well tp bunyi tu kuat jgk okla jnji af berfungsi dgn design color sgt cantik,2
fast delivery order thirty eleven item rcvd two twelve good quality product nice colour buy birthday gift mom amd like much thank seller good service,2
fryer water accepted good condition beautiful satisfied designs best delivery price seller respond very well,2
congratulation destination ! condition item tiptop packaging package post out fast hungry night plug nugget fryer thank !,2
"alhamdulillah , also one package , best package best",2
performance function very well safety very safety ! thanks seller item receive good condition packaging very nice safety berfungsi dgn colour sangat cantik,2
"performance perfomance not intercourse new item safety item survived without flaws blew beautiful , thank god , congratulation problem delivery pace amik , three day jeh sentence particle make bakartwo later kt umah later",2
fast delivery design very beautiful color beautiful quality tak_pasti but plug not use gifts kawen subordinate sorry video xda little,2
good service seller delivery fast came superb condition no dents scratch wrap well many layer cupboard satisfy purchase af works well super convenient fast cook healthier way,2
item arrived safely cuba ok tak_ade rosak delivery price price muarah,2
"packing secure good condition , sgt ! sound ok cook , n't make adjust time temperature , try cook nugget , 's ok .",2
performance good faster cook safety balance due close good fryer arrived safely thank very very fast delivery three days arrived good condition n no_scratch,2
up good condition post prize rate mile packaging great water fryer box cork around best box best seller satisfied fryer look smart design trkini looks exclusive,2
item receive wrap wall double box box xda rareate dh cube cook ok sgt sound xda la strong biases je xda smell plastic pn klu klu betol² ikot instruction first time use,2
seperti diharapkan mmg patut masuk senarai top ten air fryer pro design warna cantik features adjust timer harga berpatutan con tray takde penekan lock nak bukak xboleh one tangan,2
"best item worth efficient delivery easy work kitchen thank , best delivery item properly efficient",2
colour nice good quality test function haven try buy using food buy gift friend wedding really super duper fast delivery satisfied recommend comes warranty card too,2
giasssss air fryer ni mmg best malaysia brand gaiss price capable belonging best buy vacuum buying water fryer .,2
"thank seller ! ! delivery fasting goods complete with try and function function to buy time promotion eight eight so i get cheap prices , i last long , mother satisfied jenama hehe",2
delivery speed item very good condition even takde kemik takde defect sound water fryer very slowly function properly buy gang,2
alhamdulillah terima kasih barang selamat sampai dah barang di bungkus dengan kemas kualiti barang sangat baik dan puas hati layanan dari seller pun memang tip top penghantaran cepat sampai harga berpatutan supplier terbaik tq seller,2
nice design easy use easy clean reasonably large capacity very practical everyday use materials seems solid responsive helpful seller two year warranty downside no_sirim sticker hope last long time safe use tq,2
love looks sleek handsome ! af function well first trial fry fries works taste texture like u deep fry healthier without oil worth buy really helps moms buy sale u save cashback voucher,2
safety safe performance perform fast delivery ! an fryer versatile kitchen appliance offer healthier alternative traditional frying uses hot circulation cook food producing crispy textures less oil ideal quick meals easy use energy efficient perfect making guilt free fried dishes thank,2
"performance good goods prices safety parcel until without disability goodjob seller buying goods sale seven seven very cheap price perrysmith ni brand good ever buy vacuum still hold , thank god choice goods perrysmith",2
tq perry smith love second time buy u first item cordless vacuum very high quality product fast delivery safely arrived well good packaging,2
fast delivery ! packed carton product box no scratch tray quite big u see i tried using first time today overall good fan find big food okay bread cheese egg gon na explore recipes fryer !,2
performance well function sangat nak guna safety mudah digunakan saiz pun tak_besar tak_kecil sangat sedang elok warna terlalu cantik blue metallic mak pun suka packaging tip top ada two lapisan kotak fragile sticker overall puas hati ! ! feeling son buy hehe,2
delivery fast good cs team item great sturdy very premium quality product does job frying chicken cake size good medium size family totally worth,2
"color very exclusive indeed use little sound mcm middle process order make barkut even okay beautiful need careful body hot , handle je tak_panas very much -haired",2
performance good function safety definitely yes satisfy shop shopee item okay yesterday delivery time changed but thank shopee seller courier recommend,2
order seven seven sale sabah four days indeed pace far goods good condition testing water fried chicken wings results best seller ! satisfy purchase colors shape water fryer also attract thank,2
ordered tenth received sixteenth considered fast delivery smart ellegant pattern function well seller promoted reasonable price and im satisfied thank,2
performance design nice gler performance tip top safety far good arrived good condition no damage thumb packaging very secure design superb very stylist yet neat design harapnya berfungsi thank !,2
cantikk match dgn warna kitchen cabinet sy hehe kualiti body dia pdn la dgn seller post dgn pantas dh test fry wedges masak dgn far good,2
received fryer good condition packing ok design look nice not yet try hope ok far no_guarantee card my friend buy early have guarantee card why,2
purchase four four twenty two received via express seven four twenty two packaging secured love design color function dah try pizza karipap frozen takes twentymin one_hundred_and_sixtymin one_hundred_and_eightymin done,2
parcel twenty fourjam place order seller memang cepat pantas buat harga memang berbaloi function dah try goreng onion ring nugget sedap crispy nanti nak try buat kek pulak thank seller !,2
"goods arrived safely , thank god , tkde problems terms delivery everything well received not try design , simple smart , hope tkde mslh mse uses later",2
best delivery sgttwo quickly beautiful colors achieve jgk nk water fryer huhuhu huhuhu defender shocking sale color even cun trust sellers even though impression mcm calar little even disturb,2
package good condition beautiful product not defect function properly try curly fries sound water fryer not too strong best seller,2
delivery post fast species perfect circumstance xde broken goods good condition still not cuba problem change rating,2
"alhamdulillah , airfryer good condition , sgttwo satisfied box , double xda , breakdown broke wp sarawak xsangka besar nmpk sumberitis sgttwo recommend",2
"alhamdulillah , i afraid afraid kekek brg smpaitwo box xde xde kemek lgsung siapatwo plastic smell , please please particle read manual given finish , n't play accuse af ni ni sian best seller .",2
safety good performance good good product quality good value money fast delivery thank seller good service recommend keep good job ! ! thank,2
so love design color everything ! hope durable ! thank seller ! best best best best best best best best best best best best best best best best best best best best best best best best,2
"best product buy ! ! delivery also large saiz pace suitable family seller , response airphyer rate suitable gift kahwin",2
"performance long use good suggestion given water fryer , right -time button temperature temperature seemed qualified .",2
performance great safety same brand beautiful colour satisfying enjoying first fry quick delivery packaged box delivery thank free gift,2
performance good safety good i open test airfryer function good condition easy used i need learn estimation time cook,2
brg brg brg brg beautiful brg brg brg brg beautiful good seller good courier sapetwo blh buy xrugi dh buy repeat buy for mak brother brother senda jiran all jiran happy use easy ank ank ank i like agree,2
"ok bold la , indeed close time , , color beautiful , please , price pretty , buying time sell lightning tq sis likes fast arrive fast",2
"best packaging best seller seller not little one best rosak also courier j t keeps sis item , price very fast delivery .",2
received item excellent condition east malaysia takes two week receive box still nice takda koyaktwo pun try function very well easy use sound okay la not_too loud like normal machine operate la bunyi dia lebih kurang mcm bunyi baby sterilizer thorbaek ! !,2
very satisfy w purchase buy rmone_hundred_and_seventy six seven seven sale packed well masak ok cooking well bunyi pun tak_bising sangat warna pun cantik packed two boxes,2
try first rate hahah okay boek item takde calar receipt box even sound like oven 's ready best ah ah,2
dh item safely delivery very fast smlm post arini dh design attract colors very beautiful x patience nk tq seller,2
nice packaging item reach good condition buy offer worth design very pretty capacity quite big also just accidentally adjusted extra time not manual adjust back unless dont mind force anyway overall awesome !,2
love af especially colour design working very well see pic crispy nuggets no regrets buy sale really worth only issue courier left top pillar without inform luckily i saw msg otherwise passerby could take away,2
goods arrive good condition buy time nine nine sales prices best beautiful color design mmg cun ! dh cuba uses no_bising sound sgt,2
air fryer sampai selamat cepattttt sabah pembungkusan double kotak badan af sangat cantik nampak elegan calar berfungsi sangat dah try masak ayam tadi memang terbaikk jimat sihat highly recommend shop ! thank u !,2
"a day , i arrive poslaju hokey , i stuck kekek calar corndog frozen , sound ok , i n't , name okay , please buy i sat cart , right",2
delivery speed item good good condition takde defect packing packaging double box ok functions well longer use hadian kahwin child,2
item received nicely packaging fryer good nothing defect air fryer works well overall great ! i love thank seller,2
"delivery deserves best best high qualiti not high want enter one chicken tail not_ enter , buy big six seven l , fried potato , 's ok , 's ok .",2
af congratulation morning even though xwrap seller box plastic taste secure box twollasis n pn box cork resistant af postal delivery dh try pace function function,2
fast shipping order twenty five twelve twenty nine twelve dah sampai air fryer sampai selamat takde pecah anything design pun cantik dah try tadi function je thankyouuuu !,2
i receive early expect function pretty good and chicken cook well too size quite satisfying too overall okay far no damage,2
best performancekkkkkk sgttwo perysmith brg beautiful n brandeddd mmg bisey dah repeatt mmg x never being best best sgttwo perysmith brg beautiful brandedddd mmg boude dah repeatt mmg xper disappointed ready get free giveee again,2
laju sampai even beli time sale product good packaging wrap sleek nice design worth buy love thank perry smith done use cook overall ok nice,2
tqvm seller well packed arrived safely have opened yet use but item look intact looking forward using well reviewed fryer tqsvm,2
fryer water very beautiful like square shape looks luxurious very cheap price .,2
yeay alhamdulillah received item well dah guna dah very easy top guide dishes rest google design color pun cantik nampak classy minimalist sorry video unrelated,2
good packaging service seller amazing super fast next day delivery kl ! look forward putting fryer use,2
"alhamdulillah , water fryer safely without trouble stolen check everything early best color very charming , not try cook sound , noise particle noisy very light big thank perysmith !",2
would give ten stars could ! one good service quick response fix issue immediately thumb service team indeed two superior quality product luxurious look external solid interior diamond coat pan basket reliable seller highly recommended,2
"thank , big sellers get cheap prices , fast delivery , wrap good condition , thank , thank",2
item safely function well cuba bkar chicken fuhhh beautiful talisman oil talisha,2
delivery very fast barang sgt cantik biru yg tiada cacat cela kotak yg sgt cantik dah cuba mmg terbaiklah letak drummet mmg cantik kejadiannya trust seller tqvm,2
"item reach state okey wrapping , ok , i think 's ok , order eighthb thirteenhb puashati , beautiful design n't cuba , i hope everything ok",2
"tq seller i buy new payday period cheap , fast shipping , fast shipping , well , seller well guard , item delivered well , lps unboxing , continue try xcite new item , right",2
"punya palajuuuuuuu delivery packaging congratulation hard boxes 's cheap , beautiful color rare best kitchen cabinet try cook drummet nuggets thank seller",2
good product quality affordable price ! buy twice one family one friend ! love design color everything perfect !,2
performance good safety good delivery very fast goods good condition not_damaged easy use i like very much,2
item received good condition color nice also fav color first try okay n hope used forever recommend buy time sale n worth tqsm seller,2
performance good safety no_simil no cuba anymore even tho takde sihrian malaysia hopefully congratulation la long term overall wrap well happy state delivery deserves order shopee ten ten ten,2
"goods congratulations packing even beautiful delivery very fast even though postage miri sarawak tried everything functions well tq seller next son , son , son , son , son , son",2
fast delivery rcvd good condition easy use quite big space really great product i buy durint eleven eleven price really low thank ! !,2
performance good faster cook safety safety opened stops working item good working people students doesn take time cook cheap,2
fasters delivery ever ! love fryer fryer very light not_too big not_too small very convenience really recommend,2
item fast beautiful package very three days i try cook hot dogs try ten minutes cook nice place big sentenced particle cook overalls nice punta water fryer ni quickly hot i cook former je,2
item boxed nicely arrived rainy condition seller put item double boxes no dent scratch item good looking nice design fryer good product quality good value money item buy solely wedding gift friends,2
i share use takes quite time gorgeous colour pretty actually quite big spacious sound indeed bit loud think standard af really convenient easy use my chicken fried really well sent really quick,2
received item well good condition good job seller courier handle well buy sister likes no_problem far buy shocking sale get cheap,2
response very fast fast delivery tq poslaju barang sampai dah guna very easy save time recommend nak try fryer,2
good product quality original perry smith product like product product delivered box fast delivery within three days amid mco highly recommend five star rating,2
barang diterima cantik sangat suka dgn warnanya dah cuba pakai berfungsi dgn tq seller htr laju sangat tq poslaju htr brg,2
"finally also buy one dh long time nk , nk , fryer very srsly nmpk exclusive design light , too , too heavy capacity also cpt .",2
"goods good double packets spokes tq seller warranti kad xda cop , kind kind , son , problem , huh",2
pleaseeee beliiiiiiiiiiii sangattttttt bagusss sellerrr bagusss bagussss pleaseeee beliiiiiiiiiiii sangattttttt bagusss sellerrr bagusss bagussss pleaseeee beliiiiiiiiiiii sangattttttt bagusss sellerrr bagusss bagussss pleaseeee beliiiiiiiiiiii sangattttttt bagusss sellerrr bagusss,2
"everyone receives good state everyone receive good condition , everyone , accept good condition , everyone , accept good condition , everyone , accept good condition",2
air fryier diterima dicuba berfungsi sempurna bentuk warna digumakan pembungkusan kemas penghantaran ok harga berpatutan bersesuaian trust seller,2
item well wrap packed very pretty color seems work really well very happy purchase delivery pretty smooth also kudos everyone work hard !,2
"item fast even though buying sale twelve twelve function ok ok comes two tq seller boxes next time , buy item offer bli mixer brand ok too",2
item received good condition tray bit tight sap every corner wondering sap uproot selling spare parts maybe anyway cook test fries cook well fryer tak_buni strong noise,2
"best food also exclusive exclusive design very exclusive , very non -stick , best seller oh btw sound ok la x la noisy sgt good productttt",2
very quick delivery dlm two jeeee ! seller ship order puas hati tgk warna mhl cantik lak tuh packaging tip top warranty card two year mmg buat research fryer nih top rate saiz dia x x kecik harapnya performance dia pon high quality yg boleh beli korang mmg puas hati,2
tqsm seller beli seven seven dpt hrg murah cntq design n wrna dia blm guna lg tp dh try dpt free gift silicon kitchen utensil tq seller,2
safely arrived ! ! wait try cook ! one love color two love design three love shape cook area four plug three pin five fast delivery good packaging ! untuk masak tu biasalah bunyi bising sikit tapi ok jer tak berat sangat kalau nak bawak balik kpg pun,2
brg congratulation ! quite raju pulak poslaju flood season ni hihi elok item wrap double box dh test pon light warranty kad pon kawen prize hopeful cousin likes tq seller !,2
"mmg packaging item useful , beautiful design two_thousand_and_twenty one style saiz , even bit rather large cook chickens function fry without oil , buy seven seven sales period two_thousand_and_twenty one",2
barang sampai elok bunyi pun tak_kuat sangat dah try guna berfungsi cuma part nak bukak tu susah siki sebab xde button kena tarik kuat sikit buka,2
packaging dlm kotak kotak dh check good condition no dented no_scratch color navy blue expectation n function good easy operate thank u pery smith verytwo recommend buying get item within week,2
safety use three pin plug fuse plug performance far good thank seller fast response chat postage easy make menu diet using fryer,2
dj fried potato n nuggets okay cheap prices very cheap buying delivery deserves keep talisman talisman less oil,2
quick delivery poslaju seven nine postage eight nine arrived safely not time use anymore air fryer indeed cun color,2
received good condition ! and fast shipping too ! buying i saw viral tiktok i don regret buying ! first try use chicken really crispy ! thank perysmith !,2
safety safe enough performance very good i loveee experience senang nak guna pusingtwo je for i prefer type digital terbaik sihat,2
receive fryer good condition yesterday fried tahufoo fish very happy thr turn work very excellent i save cook oil will stay healthy thank much fast delivery value money good product quality well add thank,2
performance works well test two month safety far good model turns container not_fully inserted good purchase arrived safely packed extra box working well quite easy use previously first gen phillips model works sound bit noisy new model bit silent dials easier use added safety feature not_turn unless container part pushed fully,2
finally fryer ! ! buy payday sale cheap price everything far good delivery quite fast packaging okey hope last long thankyou !,2
brg good condition survivors seal good xda box part two -layer box indeed best delivery buy price,2
threerd time buying pery smith air fryer one mom one mil finally one everyone loves easy use easy clean good size competitive price won regret !,2
"dh i buy shocking sale nine nine prices beautiful stuffed sgttwo sellers , pace item also pace work love sgttwo design",2
well received buy wife long time wan na airfryer far everything works well good packaging best delivery service honest one fastest item im received took three days thumb seller,2
buy wedding gift student loves much ! modern n aesthetic build ! easy use nice colour good healthier lifestyle time energy friendly delivery within one week buy twenty five nine payday sale cost rmone_hundred_and_fifty include post,2
"one quick delivery packaging happy two colors remind matte sparkling beautiful very three three try cookball ok meatball cook old age long time , little four likes wash big capaciti satisfied recommend recommend",2
woww delivery fast ! item next day incredibly fast fryer big n nice looking think not_that big love colour n design haven tried yet hopefully working well recommend,2
"second time i buy , like color design af , i buy , time , i buy besday prizes village , very satisfied safe seller",2
packaging very packaging dent detects damages fast delivery two three days item may hold big fryer room beautiful mcm ads ! buy beautiful cheap brands item continue work works ! ! keep seller,2
performance ok safety ok fast delivery parcel well takde rosak calar not used use easily very effective beautiful long time buy color tq seller,2
hahahhaa seronoknya first time try masak jadi sedap very elegant colour size match new perry smith vacuum stick beli la beli,2
fryer function very well i tried making cheese garlic bread turns perfectly good ! makes bread crispy size not_too big nice overall satisfied !,2
item accepted good condition quickly also delivered problem long sufficient good luck buy shop very satisfied buy item new heart very very satisfied tq,2
nice color nice design cantik sangat i like very much easy use make job easier kitchen healthy cooking too thank seller,2
"ship join state day shoppe type urtign want buy please consider goods good condition trouble test using bengaloi price durability uncertain , product very good read manual use two layer box styrfoam",2
good product quality goof value money fast delivery good product quality goof value money fast delivery good product quality goof value money fast delivery,2
fast delivery limbang seller courier no damages detected parcel fryer beautiful easy use feel proud buy cheap price hehe thank seller,2
"packaging secure very , very , best , fast je beautiful , water fryer color dark blue , longer try cook anything , heat , please okay may durable thank seller",2
safety safe performance good work well indicate follow safety instruction clean test use fryer my currypuff turns well a great purchase value money,2
fast service delivery tooks three days arrive ordered plus fryer wrap box two times,2
"quick delivery not tried anymore , ripe room not accordance grill one chicken tail , ok la price qualiti resistance , last long , help maktwo utilize cook period",2
barangan accepted good condition wrap boxes fast delivery barangan ok x very satisfied bunyitwo thank seller,2
best price environment not apatwo said reset button brilliant delivery service deserves standard packaging overalls product,2
delivery fast good seller nice thank seller delivery fast good seller nice thank seller delivery fast good seller nice thank seller delivery fast good seller nice thank seller,2
"packaging veryttttttwo satisfying double box not cubaa sound not very strong , very satisfied hopefully hopefully surple recommended order twenty three twenty nine fast delivery country bayuuuuuu",2
just time mother day so happy new model classy blue elegant nice addition kitchen delivery guy good handling no dented box packaging comes two layer too,2
received item good condition photo helps seller understand real practical test actual situation hopes helps minor scratch color distortion acceptable no dent metal area no_broken plastic surface test power heat,2
received item waiting three days think come double box without bubble wrapping arrived without dents no hard copy warranty card given seller easy respon claim warranty damage quality ok less noisy no sirim space not_bad quite large design aesthetic look luxury item easy use smooth open close no touch screen so far satisfied price,2
received thousand thank ! item good condition without damaged well packed also super fast delivery within day plus i like color fryer nice value money buy time sales overall definitely worth every peny spent ! ! thank seller,2
