comment,rating_star
comfortability complete material blh la nice selipar cheap smpi cntik satisfied buying sizes je kecik usual size casipar hit amik extra one size usual size fast smpi tq seller,2
comfortability soft confort material light rubber item received good condition thank seller,2
comfortability one_hundred one_hundred material one_hundred one_hundred kasut takde cantik selesa kiut delivery je hauk tukar laa jnt balik shopee oii,2
light material comfortability tuesday tq seller goods reach good condition time rate saiz ngam,2
comfortability soft material item survived destination intended thank appropriate delivery seller good wrapping price,2
comfortability very comfortable nice material material good nice great,2
comfortability good material good thanks sellers item received delicious very light,2
"comfortability delicious use light material ok , thank item , 's hall satisfied",2
material rubber comfortability ok delivery time packed well ordered grey color arrived pink color thank seller,2
comfortability sap material finish alhamdulillah safely accepted color saiz really beautiful hazarded soft price completion,2
comfortability very soft material material good nice comfortable great wear,2
comfortability soft lighter material great type comfortable soft lighter love well received thanks,2
comfortability soften comfort material soft plastic thank seller item very nice simple sandal will repeat,2
"material ok comfortability ok not sure durable not , low price low price goods 's beautiful .",2
comfortability rather licked soft material selpar deliciously used even though rather row -picked folded folded walking may cause large saiz feet,2
comfortability soft material goods fast until cheap prices,2
comfortability complete parcel plastic materials until good condition,2
fast delivery fit size recieve good condition,2
good comfortability good goods material goods congratulation jaya thank saller solemnity,2
comfortability light weight comfortable material rubber size follow normal size buy one size bigger also comfort wear house toilet cause bit anti slip,2
material good comfortability very comfortable item received good condition fast delivery excellent service seller,2
light material soft sap comfortability complete nipis feet according price,2
comfortability good material plastic shiper light giler but nipis laa pijak batutwo kecik confirm rase tread tak_dijamins do n't use slippery surface je laa equivalent price price,2
comfortability ok material cantik packaging ok klu size yg thirty seven tu ambil size thirty six thirty seven sbb thirty eight thirty nine sgt comel bole bawa gi kedai tq seller,2
material silicon comfortability extremely comfy love slippers comfortable wish bigger size forty five smaller size fit very well,2
comfortability very good material soft goods good condition good function very well time rate je tq order,2
"lawa item finish using ! fate taking little big usual use forty three size , i take big size finish , mcm big leg recommend !",2
good value money good service fast delivery good quality good seller thank good price,2
material nice comfortability very comfortable menyesal bli one hv buy bcz affordable n comfortable too highly recommend sandle,2
"comfortability great material very solid goods safe good , very satisfying mksh seller nntiorder",2
comfortability k material k alhamdulillah item until congratulation thank seller courier i buy price,2
material pvc comfortability good delivery deserves wrapping item accepted good condition trouble,2
prcel received good condition size nice ni tapak tak_tebal sgt ok laa tq much seller,2
nice comfortability material nice tq seller saiz forty forty one okay brg dh use ordinary nice packaging time use,2
comfortability ok material ok cheap lightest delivery difficult ok pan la la upeed santaitwo seller,2
comfortability sangat selesa material good cantik ngam dgn size yg minta nanti oder sbb ngan packaging bagus,2
material ok comfortability ok fast delivery good goods thank seller palan price,2
thank very much packaging super fast shipping ! received item good condition many thank seller,2
material rubber comfortability really nice fit nicely comfortable colour js nice i love anti slip murah tu niceeee,2
"material soft comfortability , alhamdulillah , i say hello heyday package , receive esok sm seller good transporter , thank .",2
item reach kene price ok nice light x slippery using tq seller,2
comfortability nice quality ok nice quality awesome thank i will buy,2
quality worth price came safely parcel,2
nipis comfortability material rather small saiz actually order gray goods white xsuka white color picture thickness,0
material very thin not_as show picture comfortability not_comfortable product isbdifferent picture,0
material okay comfortability okay very slow delivery unsuccessful pick courier seller many times think first buying always automatic agent reply no_live agent !,0
ahhaaa dont get fool first pictures displayed ! though slipper comfortable dont know long lasts soooo thin compared picture picture misleading looking thick long comfortable slipper not_the one,0
comfortability soft material good item receive good condition too thin large even smaller size near one foot long u compare onefoot tiles not_recommende not_same product advertised,0
comfortability bad material thin flimsy kualiti very treat saiz too small,0
material very very very bad comfortability not_same pictures better buy another shop i buy two pcs shoes not_same pictures very very tin seller also not_responsible well i chat reply stikers last time i buy another shop good pictures please don buy shop tenq i post shoes very tin no_use,0
"material very nipis comfortability not_good , n't buy shop advertisement , another show quarter , black color , buy black , exchange blue sentences .",0
"order thickness thickness arrived nipis i know type nipis i x buy cheap price , i thick son",0
material material considered value buy comfortability ok received item heavy dented damaged immediately contacted seller seller keeps pushing away reply template even though multiple times click chat seller very terrible customer service poor response ! ! ! sizes varies amongst different colours same sizes appear big small worst seller irresponsible simply reply template chat ! ! ! ! don even worth star minimum must put least star ! worst seller ever met !,0
material very thin comfortability ok product different seller put sole very thin seller hasn indicate description delivery good though,0
"sorry , used advertisement used oil lacking one liter order one eightliter also nipined xmacam advertisement very slow ship order item eleven five item twenty one five so sad",0
"comfortability not stands long time feels feels nipis material , mcm tastes using piece cloth type , edges jeal look thick , n't use image .",0
"comfortability images goods remind slipper like gambo rupene failed laa , seliper nie sye buy nie nie nie nipis n fast thirsty tapaknye",0
i order green colour i received black seller never_inform even stock poor very bad service,0
material not_as advertised comfortability thin soles not per photo low quality duplicate ! not per photo show ! sole thin,0
"buy blue blue black , please buy , i buy not_free , please please sensitive cheap prices , like , 's not okay stock runs tofu , pm .",0
"comfortability bad material bad material middle seller 's seller , left right , old slippage image old selipar thick resistant laasak i use three year present hands selipar likes blow wind ride lazy expect i used buy long time less",0
comfortability not_bad material not_bad hai i received item but sent item incorrect item size i order blue blue color i order tje size forty forty one change size without notices seller take responbility tje mistaken but meseg seller seller didnot take good action so not recommended seller attitude responsibility tq one stars not_responsible video not_applicable fun tq,0
comfortability ok material rubber i followed comment buy one size bigger bit loose very very light weight not_quite used,0
comfortability ok sap material date twenty four brg cause posting poslaju today take oden oren colors black not look betultwo ka customer color oden aduiii tlgla whatever tq 's aq bg one star .,0
material not advertised comfortity actual selipar very different photos selipar nipined please use actual image never_repeat buy very disappointing unlike picture,0
comfortability lack lack line materials little nipis remind like image looks thick delicious using ni ni nini_best,0
comfortability not comfortable cuz not recommend item received different photo show shoe sole very thin ! ! ! outer ring shoe sole around twocm inner ring thin walk road basically feel temperature pavement,0
comfortability material soft rubber order three set two sets .,0
hard material comfortability slipper too nipis like sliper kedai rmtwo slipper x same selling image looks thick shape terms thickness slipper tread happy cite pictures slipper obtain like quality x ciplak ciplak,0
comfortability okje follow rmtwo ninety nine nine material seat slight x ade ade order with tisu tps x bant all complete selipers,0
comfortability bad not good service ask seller take answer not pugging,0
"comfortability very bad , expensive nipical plastic material eco nipis xde qualiti qualitations slow seller seller also get one kt chat xnk serving kt mlas nk returns bgi rate one follow first check goods htr custmr bad service ! ! !",0
nipis comfortability takde qualiti sap material i afraid crazy nk bg family experts use nipis nak mamm may blinking danger essentially use old people may fall road may feel tiles shape kat footprint n't buy,0
not like image near thick image one lonely i ordered delivery slow,0
comfortability ok material not_ok apa yg nampak kat video totally ! ! ! ! kecewa sgttwo video tunjuk kasut ni tebal full rubber ni dpt plak flat punya tau dia murah tapi plz don cheat customer product dlm video tu ! i rather pay little bit better quality not_cheap price kind material,0
material soft comfortability comfortable i dont know white colour very disappointed,0
"comfortability pretty x enough three , install good material seller , knp x ckup shock i ordered i ordered four .",0
seller very rude seller send wrong item i contact seller seller didn reply ! i not_buy seller,0
shoes receive wrong colour wrong size seller didn even inform buyer particular size colour shoes stock straight away proceed shipment,0
comfortability tak_sehesa material line another picture another selipar nipis very ponflies tak_elok unbotted ni repeat dah dah,0
comfortability bad material rubber nipis not_the expect visual display very not_recommended anyone,0
comfortability ok item only one item i ca n't parcel,0
comfortability lmbt skitt materials oklaa pink blueblack must shit yellow blacks black kli tnye laa used pay use money kott ! ! !,0
comfortability not_that good material rubber please check immediately receive parcel order less three pair slipper light blue thirty eight thirty nine size pink given wrongly i buy thirty six thirty seven send thirty eight thirty nine without letting know,0
"comfortability disappointed chat tak_lay material receiving four je hallet , come answer front god , son , bisnes , know , know , thank , seller , temperament , hahah",0
maaf video kene mengene order saiz forty forty one dgan forty four forty five tapi sampainya forty two forty three bila chat tak_replay,0
material getah comfortability selesa oder warna hitam twopsg tp sampai duatwo warna biru,0
material not_reliable comfortability not_comfortable product received safely materials slippers quality not_according advertised ones cos soles slippers too thin easily curled walking cheat game,0
"alhamdulillah , item arrived home quickly worthy",0
"lightweight selipar material selpar long , lazy review postal item seller not enough i ordered four installing selipar three pairs seller not_pos .",0
ok materal comfortability ok order colors bg colors order fourteen ten twenty seven ten dah cancel refund tibatwo i color tak_sama ordered i sell person buy cancel slowly chat .,0
comfortability low quality disappointed color ordered different i received ! i haven ordered black selipar sent three white yellow also not_in list !,0
comfortability black shoes didn come material very bad send message without reply black shoes didn come i won it next time very bad very bad sendiri message without reply,0
comfortability thick sliper image comes orders sellers x honest not make offer far clear stock,0
comfortability white oder gray chat seller xreply ! so sad ! dah la six install ! okay material color wrong !,0
material buy three pair received two pair seller also no_reply message,0
description not advertised website supplier cheat quality product requested grey sent white i purchase type different supplier time i cheat quality,0
item wrong color size oh seal packing item seeing mistake,0
order orde orche only blue to blace color xiinform what sampiitwo color black color service,0
bad service order four receive three contact seller not_reply so bad service,0
material soft comfortability tuesday saiz match legs finish wear gentle cause,0
buy three pairs receive two pairs parcel not_broken seller mistake didn carefully check customer order plus way seller respond no_solution i didn get compensate loss item,0
comfortability lightweight material plastic one star customer service none twenty gray slippers i order didn arrive seller chat full ai bot reply see pictures proof zero human interaction no phone number also size one runs small,0
selipar smpi beautiful sdpap pkai goods xdpt two contact sellers cool operators jwb,0
"asking color black get yellow chat seller , i n't help price hit la price",0
material tipah tertipu dlm video tebal tpi received nipos comfortability selesa cuma nipis tapak nya,0
material getah comfortability selesa oder saiz forty forty one dpt forty two forty three ok lg ank pakai,0
very bad packaging took two weeks shipping inspite reminding every day i order thirteen april seller ship twenty seven some order i use raya too much delay i didn receive time very bad service,0
material not_really good comfortability still ok seller simply post without inform stock stock received color not_the size also incorrect last i ask refund return,0
material not really good comfortability still okay not recommend seller simply post stock size color received incorrect,0
"incomplete item ! ! ! ! goods slow ! request request canceled , buyer 's precepts buy shop",0
i would rather not_giving star very bad seller sent incomplete order request refund seller not_even properly response shopee not_being helpful item receive forty bad condition ! ! obviously defected rats bad storage won dare use throw item received please refund money item didn receive defects item don buy seller ! one_hundred bad experience ! !,0
i no_comment shipment please see comment picture as buyer accept like ! i try cancel order seller reject i tried talk seller seem like no_human respond auto reply i suggest don buy shop not_because shipment slow no_customer service,0
"comfortability item not enough item oder not enough oder begs slipar cover seller seller not respond properly , ask seller refund money , seller not make service",0
comfortability not_same picture material rubber i buy three pairs received two pairs seller repond auto message not very helpful given price ok lah but honestly very dissappointed slipper show fluffy n looks comfy but reality not and easily stick floor tile walking,0
poor seller not_respond enquirers message response sticker week ordered twenty item rmone_hundred six item arrived seller not_bother resend missing item no_action end well buy risk,0
being cheat stared thick sole received thin sole when want sell product please frank your customers not_buy i want make refund back i wear sole too thin,0
not best material cheap material totally different image image thick sole receive no_more different pasar slippers stop use image mislead people,0
"comfortability , too thin material chat tak_responsive , i must request , son , cancel , reject even though new place fluent .",0
"very treat , seller six item two item 's order , not chat , ask tak_reply , directly , bot je reply bruised not less information replace item price prices",0
comfortability nice slipper poor service i buy four slippers received twopair very poor service seller chat seller never_reply still waiting shopee refund missing item many days,0
slipper received bigger size different colour my order green received pink colour bigger two size bag order black received blue colour one never inform change order,0
"comfortability plastic material no_order three pairs get one tana sentence particle may refund loss 's expensive , ni nipis nipis not_best , n't use , n't buy pictures jelawa",0
comfortability ok ok ok ok ok aspect kene price qualiti rather rather row use stumble rather large front tongue aspect,0
seller not_responsive send sticker reply order fifteen item ship five don reply messages make effort ship missing stuff avoid this shop,0
"i n't know , la seller wrap x beautiful courier goes open top box tear , 's stakat , ok , 's ok",0
"comfortability ok je material ok i ordered colors sellers black , i waiting xjur .",0
comfortability not comfortable material hard although seller using photos videos like seller slipper not_the soft one very hard,0
nrgn smpo xckup order three dpt two dh chat ng seller tp komputer yg reply sgt xbest video nnpic xde kaitan sb sandal xde ng sy skang kt klas,0
material two pairs shoe fine but misssing one pair grey color slipper question service poor no_respone dissapointed,0
crazy nipis material seller dah msg msg reboots je reverse courier service nk pickup fun x look game long time seller,0
comfortability i order carton slipper receive poor slipper fraud seller i order carton slipper saller delivery poor cheap slipper fraud saller,0
"terokk betoll bad one , calar calar kt bottle seller not not_check first bottle okay takk haih",0
material horrible quality ! pictures show better quality item expect price ! will not_buy product sure,0
comfortability disappointed disappointed seller not_honest item not seller show photo show thick base actual one thin,0
comfortability none material none item not lost packet journey tear seller not responding question item,0
comfortability thin hard material not good as advertised not advertised nipis hard seller not honest commerce,0
comfortability saller tipu material saller tipu saller lie order six give four babii lahhhh work properly,0
buying materials delivered x mcm gmbr buy three pairs sellers xde action anyway n't,0
thin gum material comfortability not_comfirt slipo sap nipis crazy xsama mcm gmbr n't buy slippery tread nk location kt pon water booth,0
comfortability ok nipis materials worthy lower hatitwo buy seller bole join like orders orders,0
material not_same photo photo show thick received thin buy size forty received forty two buy pink receive grey,0
quality not_as expect ordered four pairs received three pairs owner didn respond asked regarding missing pair,0
comfortability bad material bad i pay threepair pink black n silver n two pair pink n black,0
order item three colour tapi two item colour one item colour x ckup bile tanye seller jawapan berbelit belit,0
material beg green blanket blue comfortability bad service received not_same colour seller not_inform onest change bad service,0
"i star , near pic reach thick one",0
material not good comfortability not good images outside words picture looks beautiful tak_sama like picture not_bad,0
slow delivery received color size seller xrespon messej onest last buy kt shop,0
comfortability tak_see too licen material ok beautiful image real too litis x suitable use outside,0
material bad comfortability bad bad service give wrong item said check no_answer ! ! ! ! ! ! ! ! ! ! !,0
order three item one item not enough blue slipper package,0
language materials orders high -time slippage image ordinary ii,0
"slow crazy brg post comes , not preorder takes time",0
comfortability not comfort material hard material is bathroom slipper get mr diy too,0
bad service saller langsung x reply chat harapkan robot je reply last beli dekat kedai ni,0
bad comfortability material nipis display selipar cover another thick tread display tread nipis propeller dog .,0
beli hitam dpt kelabu bila chat no_respon teruk atleast ckp sentence particle tkde wrna hitam,0
comfortability item no_same picture material item no_same picture wrong item,0
service mcm tahik order three sampai two order kaler smpai bile tnya xde respon puihhhh,0
post slowly month deduct goods not enough 's too baddd,0
only use d thin hotels slipper x strong tp high school level item price,0
lain colour order colour dtg order warna kuning dpt warna hijau order warna oren dpt warna hitam,0
order three sampai two chat seller respon first n last beli kat seller ni,0
comfortability selipar oder three dpt two msg seller tp seller tak_reply bad service,0
very bad service seller lad slow delivery chat x never reply,0
oder five pairs fourpase jek messej xberbales oder another piece pon pound bad seller,0
i oder threar twopasing je seller tak_respon i pm diaa,0
saiz kecik selipar dh lh lipstu loudly sipar hot slipped kecik,0
material nil comfortability nil i didn receive item slippers seller didn send,0
very bad item photo totally not_same very bad quality very disappointed,0
product receive not_same advertised size also wrong,0
material dont buy took month deliver very bad experience seller,0
wrong size spsg fan one order two chat seller x serving too,0
material not_ok comfortability not_ok i order blue tapi light blue,0
item x enough chat seller directly x service automated message comes,0
comfortability ok material not_same picture thin not_soft type,0
comfortability bad i receive shoes company service bad,0
regret xtgk review xsama loud nipis n picture,0
comfortability quality not_at state thin hard,0
"kinds sam pon buy type not_mcm time nipis one always buy qualiti mmg last picture , look beza previous purchase recent",0
missing one item tried contact seller no_reply i gave one star,0
oder selipar thick load hmmm penaga penaga aduhh,0
please don buy seller ! ! ! ! cheat ! ! ! ! ! posted green circle delivered red circle quality ! ! ! ! i buy pink black blue color all buyer please careful ! !,0
please don buy seller ! ! ! ! cheat ! ! ! ! ! posted green tick delivered red cross quality ! ! ! ! i buy pink black blue color all buyer please careful ! !,0
please don buy seller ! ! ! ! cheat ! ! ! ! ! posted green circle delivered red circle quality ! ! ! ! i buy pink black blue color all buyer please careful ! !,0
oder saiz hntr saiz other x chat klu saiz dh after len kali sila jjr org buy dh x may use,0
comfortability ok material nipis muat sesuai dgn,0
"hatitwo ye order two one item xcu one ways seller , another item reorder , tired kite , time three i seller shopee seller , x fight paper very like way . shopee agent get mcmni sellers makeesure fight je press refund refund mls , son , waybill .",0
receive morning wear hour broken,0
comfortability no_comment material no_comment delivered againt advertised unacceptable careful guys,0
disappointed not thick color picture not beautiful,0
comfortability too hard material thin not advertised,0
sellers cheat tread x picture,0
"buy another size htr size good xpayah sells nk deceives mcmni , chat another color",0
"item advertisements not_sama item drive , hope seller actually correct available",0
order three pasang tp one je msj pun x reply,0
two pair received one pair contact seller no_respond yet today sorry one star honest review tq,0
"i ordered three item two item je ! ! loss sentence particle voucher free rmtwelve shoppee for me camni ! chat saller threcurre language exchange even computers answered ! ! keep right ! know , buy shops , je ! i dh ckp tak_respond i rate je onestar kt here ! !",0
hello ! i don know give good review item i ordered still not_enough i ordered two item received one item i ordered another item seller still hasn sent item i haven received yet very disappointed ! ! !,0
not_recommende shop purchase color grey size thirty six thirty seven received color pink size forty forty one try ctc seller resolve issue not_responsive luckily cheap,0
buy nine selipar eight je kinds mn seller conduct pair lg light blue x parcel,0
case comes getting less even though not expensive least needs mistaken jawapan solution along evening,0
i ordered two one chat delivered picture not_reply,0
i buy five item four item received,0
comfortability barang elok tapi oder six sampai five,0
order slippers but get pet diapers chat seller but tak_layan tak_ period,0
color oder materials colors problems nearsightedness,0
ask jet blue liquid blue hmm another color,0
comfortability cun material cun oder grey get white,0
barang tak_sma dlm gambr nipis,0
"i oder , one pair",0
kind seller finish ! ! total purchase rmtwo_hundred_and_twenty three thirty nine orders not less four five item include selipar fourteen pairs packaging still packaged not posted images i print screen not sorry video not relate,0
material x nipis suitable kitchen paint water booth,0
"sorry really disappointed colors get colors , cancel colors , not , n't need least lack sentence particle",0
cheat ! said thickness nie nie litis seni skin onion ! cheat ! pictures item,0
"one item not_d_den request refund one item not_du notification word tak_benhakan refund stem shared not_tah la mcm install , angle xleh , attach loss , buy not",0
lazy nk ckp hit byr twice stipation seller n xnak respond first xckup dh byr plak plak tpp hit stress one .,0
i ordered four slippers three i contacted seller regarding unhelpful automated replies i couldn even request refund i opened parcel without record unboxing video,0
